{
  "profile_id": "claude-code-minimal",
  "profile_kind": "minimal",
  "profile_version": "3.0.0",
  "configuration_identity": {
    "id": "profiles/claude-code-minimal.v3.json",
    "sha256": "e143de83607f4df7de3e06ab4fa1c1fa53fa51770621b9e1bb3765d0a5ddce00",
    "version": "3.0.0"
  },
  "provider": {
    "status": "not_available",
    "reason": "runtime and provider selection are independent"
  },
  "model": {
    "status": "not_available",
    "reason": "runtime selection does not infer a model"
  },
  "agent_runtime": {
    "id": "claude-code",
    "version": "2.1.251"
  },
  "adapter": {
    "adapter_id": "claude-code",
    "adapter_version": "1.0.0",
    "resolution": "lazy"
  },
  "core_skill": {
    "skill_id": "stolz-route",
    "version": "1.0.0"
  },
  "core_skills": [
    {
      "skill_id": "stolz-context",
      "version": "1.0.0"
    },
    {
      "skill_id": "stolz-reuse",
      "version": "1.0.0"
    },
    {
      "skill_id": "stolz-quiet-state",
      "version": "1.0.0"
    },
    {
      "skill_id": "stolz-route",
      "version": "1.0.0"
    },
    {
      "skill_id": "stolz-benchmark",
      "version": "1.0.0"
    }
  ],
  "optional_integrations": [],
  "task_identity": {
    "id": "runtime-profile/claude-code/minimal",
    "sha256": "1af62daf32099ff929ce8c7eb225b9eeb1fb08c0635861ffa69e234f8c631f28",
    "version": "3.0.0"
  },
  "source_artifacts": [
    {
      "id": "fixtures/runtime-adapters/claude-code/c0.fixture.json",
      "sha256": "119073d79978c46d66feed0c4062c7d23a06ea38c84645fb5a6cb030e4d15224",
      "version": "1.0"
    }
  ],
  "measurement_session": {
    "id": "runtime-profile/claude-code",
    "sha256": "29eb1b04576f232d1b31b17126b210195e4ca9942ed9f6747aba755539c304ea",
    "version": "3.0.0"
  },
  "telemetry_availability": {
    "provider_tokens": "not_available",
    "runtime_events": "not_available"
  },
  "context_budget": {
    "context_unit_source": "profile-authored units",
    "max_initial_context_units": 100,
    "max_total_context_units": 160,
    "initial_context_units": 50,
    "total_context_units": 50,
    "initial_context_ratio": 0.5,
    "context_budget_risk": false
  },
  "reference_loads": [
    {
      "identity": {
        "id": "skills/core",
        "sha256": "7bdbc4c98ce5c8469af8b5147bcd9f6fb08d903774438831df6dbb6ef7706124",
        "version": "1.0.0"
      },
      "classification": "core",
      "units": 50,
      "load_phase": "before_route_selection",
      "trigger_id": null,
      "load_count": 1
    }
  ],
  "runtime_install": {
    "runtime_id": "claude-code",
    "destination": ".claude/skills/",
    "selected_only": true,
    "adapter_activation": "lazy",
    "hooks": "not_installed",
    "mcp": "not_installed",
    "fallback": "provider-neutral"
  },
  "settings_provenance": {
    "sources": [
      {
        "scope": "project",
        "location": "fixtures/runtime-adapters/claude-code/settings-provenance.json",
        "sha256": "6073b812d60e78934ad31a14e6604c41020ed54f8d4ecf994cce072e808afd17"
      }
    ],
    "resolution": "recorded without reading credentials",
    "captured_at": "2026-08-30T00:00:00Z"
  },
  "provider_overlay": {
    "overlay_id": "none",
    "schema_version": "1.0",
    "availability": "none"
  },
  "certification": {
    "level": "C1",
    "status": "cli_certified",
    "evidence_ids": [
      "claude-code-c1-cli"
    ]
  }
}
