{
  "profile_id": "codex-evaluation",
  "profile_kind": "evaluation",
  "profile_version": "1.0.0",
  "configuration_identity": { "id": "profiles/evaluation.v1.json", "sha256": "4b8091a80d3ab2073c8e4ab2e51ab8b7201073e678529eed064287ccc805be2d", "version": "1.0.0" },
  "provider": { "status": "not_available", "reason": "the profile records no provider telemetry" },
  "model": { "status": "not_available", "reason": "the profile records no model telemetry" },
  "agent_runtime": { "id": "codex", "version": "1.0.0" },
  "adapter": { "adapter_id": "codex-local", "adapter_version": "1.0.0", "resolution": "lazy" },
  "core_skill": { "skill_id": "stolz-benchmark", "version": "1.0.0" },
  "core_skills": [
    { "skill_id": "stolz-context", "version": "1.0.0" }, { "skill_id": "stolz-reuse", "version": "1.0.0" }, { "skill_id": "stolz-quiet-state", "version": "1.0.0" }, { "skill_id": "stolz-route", "version": "1.0.0" }, { "skill_id": "stolz-benchmark", "version": "1.0.0" }
  ],
  "optional_integrations": [{ "integration_id": "benchmark-capture", "version": "1.0.0", "capabilities": ["raw-evidence"] }],
  "task_identity": { "id": "runtime-profile/evaluation", "sha256": "1b50a3268d4983510d89dbb0a765806c5bf6b6ac99ae57f72824ad383bf95ea0", "version": "1.0.0" },
  "source_artifacts": [{ "id": "docs/adr/0005-runtime-profiles-and-lazy-adapters.md", "sha256": "cc0c63a20cd15f699c73cae0c5de07e6d91ea80e50793da037912ce54ec52718", "version": "1.0.0" }],
  "measurement_session": { "id": "runtime-profile/evaluation", "sha256": "038b6ea408f7bf9c1b32620c983ebefed5c1ec3533f54816a48d15c4c34a0599", "version": "1.0.0" },
  "telemetry_availability": { "provider_tokens": "not_available", "runtime_events": "not_available" },
  "context_budget": { "context_unit_source": "profile-authored units", "max_initial_context_units": 100, "max_total_context_units": 160, "initial_context_units": 50, "total_context_units": 50, "initial_context_ratio": 0.5, "context_budget_risk": false },
  "reference_loads": [{ "identity": { "id": "skills/core", "sha256": "46b10d77b2814ec84a4db18f597f739dd5703f65a1f1c1d84bdbda0fb926581a", "version": "1.0.0" }, "classification": "core", "units": 50, "load_phase": "before_route_selection", "trigger_id": null, "load_count": 1 }]
}
